{
  "agents": {
    "analyst": "agents/analyst.agent.md",
    "architectureReviewer": "agents/architecture-reviewer.agent.md",
    "codeQualityReviewer": "agents/code-quality-reviewer.agent.md",
    "deployer": "agents/deployer.agent.md",
    "deploymentReadinessReviewer": "agents/deployment-readiness-reviewer.agent.md",
    "documenter": "agents/documenter.agent.md",
    "harness": "agents/harness.agent.md",
    "implementer": "agents/implementer.agent.md",
    "llmBehaviorReviewer": "agents/llm-behavior-reviewer.agent.md",
    "qaBugChecklistReviewer": "agents/qa-bug-checklist-reviewer.agent.md",
    "qaCoordinator": "agents/qa-coordinator.agent.md",
    "raiReviewer": "agents/rai-reviewer.agent.md",
    "releaseManager": "agents/release-manager.agent.md",
    "requirementsCompletenessReviewer": "agents/requirements-completeness-reviewer.agent.md",
    "scaffolder": "agents/scaffolder.agent.md",
    "securityReviewer": "agents/security-reviewer.agent.md",
    "testCoverageReviewer": "agents/test-coverage-reviewer.agent.md",
    "uxAccessibilityReviewer": "agents/ux-accessibility-reviewer.agent.md"
  },
  "cloud": "core",
  "description": "Cloud-agnostic agents and skills shared by all cloud packs. Canonical home for the generic deployer agent (inherited by cloud packs, ADR-0001 decision A).",
  "displayName": "Core Pack",
  "name": "core",
  "skills": [
    "skills/sdlc-adr-authoring",
    "skills/sdlc-architecture-review",
    "skills/sdlc-canary-runner",
    "skills/sdlc-code-quality",
    "skills/sdlc-project-manifest",
    "skills/sdlc-project-qa",
    "skills/sdlc-project-scaffolding",
    "skills/sdlc-qa-bug-checklist",
    "skills/sdlc-reference-catalog",
    "skills/sdlc-requirements-discovery",
    "skills/sdlc-reviewer-output-format",
    "skills/sdlc-security-review",
    "skills/sdlc-stack-profiles",
    "skills/sdlc-workspace-init",
    "skills/sdlc-harness"
  ],
  "version": "1.1.0"
}
