{"agents":{"complianceReviewer":"agents/gcp-compliance-reviewer.agent.md","deployer":"deployer.agent.md"},"cloud":"gcp","description":"GCP-specific agents and skills. The generic deployer agent is owned by the core pack and inherited here (ADR-0001, decision A, 2026-09-29).","displayName":"GCP Cloud Pack","mcpServers":"mcp-servers.json","name":"gcp","reviewers":["agents/gcp-compliance-reviewer.agent.md"],"skills":["skills/sdlc-gcp-deployment","skills/sdlc-firestore-repository","skills/sdlc-gcs-storage"],"version":"1.1.0"}