{
  "agents": {
    "complianceReviewer": "agents/azure-compliance-reviewer.agent.md",
    "deployer": "deployer.agent.md"
  },
  "cloud": "azure",
  "description": "Azure-specific agents and skills. The generic deployer agent is owned by the core pack and inherited here (ADR-0001, decision A, 2026-09-29).",
  "displayName": "Azure Cloud Pack",
  "mcpServers": "mcp-servers.json",
  "name": "azure",
  "reviewers": [
    "agents/azure-compliance-reviewer.agent.md"
  ],
  "skills": [
    "skills/sdlc-azure-deployment",
    "skills/sdlc-cosmos-repository",
    "skills/sdlc-blob-storage"
  ],
  "version": "1.1.0"
}
